,title,artist,year,info
291,i've got my love to keep me warm,Les Brown & His Orchestra,1948,"Written in 1937 by Irving Berlin and introduced in the 1937 film On the Avenue by its stars, Dick Powell and Alice Faye. Les Brown's instrumental hit version was recorded in 1946, but didn't become a million-selling top 10 song until late 1948 and early 1949.[91] Three other versions by the Mills Brothers,[278] Art Lund,[5] and the Starlighters also hit the pop singles chart in early 1949.[145] The song has also been recorded by such artists as Ray Noble & His Orchestra, Billie Holiday, Ella Fitzgerald, Doris Day, Dean Martin, Frank Sinatra, Bette Midler and Kimberley Locke."
292,if every day was like christmas,Elvis Presley with The Jordanaires and The Imperials Quartet,1966,Written by Red West. Charted again in 1967.[38]
293,if we make it through december,Merle Haggard,1973,"From the album A Christmas Present. Charted again in 1974. Made the Pop, Country, Easy Listening and Christmas surveys in Billboard in late 1973-early 1974.[186][279]"
294,it came upon a midnight clear,Daryl Hall & John Oates,2006,A No. 1 hit on the Billboard Hot Adult Contemporary Tracks chart.[280] Traditional carol previously recorded by over 100 other artists.
295,it doesn't have to be that way,Jim Croce,1973,"Originally released as the B-side of his 1973 single ""One Less Set of Footsteps"". Reissued as an A-side in December 1973, reaching No. 64 on the Billboard Hot 100 chart.[3][281]"
296,it may be winter outside ,Felice Taylor,1967,Written by Barry White.[115] Also a hit for Love Unlimited in 1973.[5]
297,it must have been the mistletoe,Barbara Mandrell,1984,Also a hit for Barbra Streisand in 2002.[115][282]
298,it wasn't his child,Sawyer Brown,1988,Written by Skip Ewing. Peaked at No. 51 on the Billboard Hot Country Singles chart in 1989.[103][283] Also a hit for Trisha Yearwood in 1994.[272]
299,it won't be christmas without you,Brooks & Dunn,2002,Hit the Billboard Hot Country Singles chart. From the album It Won't Be Christmas Without You.[158][284]
300,it won't be the same this year,Vince Gill,1995,From the 1993 album Let There Be Peace on Earth. Peaked at No. 74 on the Billboard Hot Country Singles chart.[93][285]
301,it wouldn't be christmas ,John Tesh,2002,Peaked at No. 7 on Billboard's Adult Contemporary chart. From the album Christmas Worship.[12][286]
302,it's beginning to look a lot like christmas,Perry Como and The Fontane Sisters with Mitchell Ayres & His Orchestra,1951,"Peaked at No. 19 on the Billboard Records Most Played by Disk Jockeys chart on the week ending January 5, 1952, and at No. 23 on the Billboard Best Selling Pop Singles chart on the week ending December 22, 1951.[96][287] First entered Billboard's Hot 100 chart on the week ending December 29, 2018, peaking at No. 12 on the week ending December 26, 2020, following its second chart re-entry. Also made these other Billboard music charts (with peak positions shown): Global 200 (No. 30), Holiday 100 (No. 8), Holiday Airplay (No. 41), Holiday Streaming Songs (No. 6), and Streaming Songs (No. 7).[288] Meredith Willson composed this song while writing The Music Man."
305,it's christmas,Ronnie Milsap,1986,From the album Christmas with Ronnie Milsap. Later covered by Trace Adkins.
306,it's christmas ,Sheena Easton,1985,From the 1985 film Santa Claus: The Movie.
307,it's christmas time all over the world,"Sammy Davis, Jr.",1963,Also recorded by the Jackie Gleason orchestra.
308, lonely christmas,The Orioles,1948,"Reached No. 8 on Billboard magazine's R&B Juke Box chart in 1948, and No. 5 on the same singles chart the following year.[150][297]"
309,it's just another new year's eve,Barry Manilow,1977,Peaked at No. 33 on the Billboard Adult Contemporary chart in 1978. From the album Barry Manilow Live.[5][298]
310,it's so close to christmas ,The Bellamy Brothers,1981,Reached No. 62 on the Billboard Hot Country Singles chart in 1981.[143][299]
311,it's the most wonderful time of the year,Andy Williams,1963,"Written in 1963 by George Wyle and Edward Pola, and selected as the theme song for Christmas Seals in both 1968 and 1976. First entered Billboard's Hot 100 chart on the week ending January 7, 2017, reaching the top 10 for the first time on the week ending December 29, 2018, and peaking at No. 5 two years later (on the week ending January 2, 2021) [the highest rank on the Hot 100 for Williams since 1963].[300][301] Also made these other Billboard music charts (with peak positions shown): Digital Song Sales (No. 50), Global 200 (No. 7), Holiday 100 (No. 2), Holiday Airplay (No. 2), Holiday Streaming Songs (No. 2), Holiday Digital Song Sales (No. 1), Hot 100 Recurrents (No. 2), Radio Songs (No. 32), and Streaming Songs (No. 3).[301]"
316,"jesu, joy of man's desiring",Josh Groban,2005,"The most famous instrumental version is George Winston's ""Joy"" from the album December."
317,jingle bell rock,Bobby Helms,1957,"Written by Joe Beale and Jim Boothe, and featuring backing vocals by the Anita Kerr Singers.[308] Originally peaked at No. 6 on the Billboard Top 100 Sides chart and at No. 7 on the Billboard Best Sellers In Stores chart for the week ending January 4, 1958. First made the Top 10 of the Billboard Hot 100 chart on the week ending January 5, 2019, reaching a peak of No. 3 exactly one year later (week ending January 4, 2020), and setting the record for the longest wait for the first top 5 hit after an artist's initial appearance on the chart: 61 years, 4 months and 2 weeks.[264][309][256]"
325,jingle bells,Benny Goodman and his Orchestra,1935,"B-Side was ""Santa Claus Is Comin' To Town"" by the Tommy Dorsey Orchestra.[93] A 1941 version by Glenn Miller and his Orchestra features vocals by Tex Beneke, Ernie Caceres and The Modernaires.[278][316] Other hit versions recorded by Bing Crosby and The Andrews Sisters (1943),[2] Perry Como (1946),[96][317] Les Paul (1951),[1][318] Peggy Lee (1960), Ramsey Lewis Trio (1964),[34] Jo Stafford (1964), Booker T. & the MG's (1966),[147] Smokey Robinson & The Miracles (1970), BeBe & CeCe Winans (1993),[85][319] SheDaisy (2000),[103][320] Kenny Chesney (2003),[8][321] Kimberley Locke (2006),[322] and Michael Bublé featuring The Puppini Sisters (2011). The 1955 novelty version by Don Charles & The Singing Dogs hit the Billboard special Christmas singles chart in 1971–1973, 1983 and 1984.[145] Kimberley Locke's version spent one week at No. 1 on Billboard's Hot Adult Contemporary Tracks chart in 2006."
326,jingo jango,Bert Kaempfert and his Orchestra,1963,Instrumental composed by Bert Kaempfert and Herbert Rehbein. Charted again in 1965.[10]
327,joy to the world,Mannheim Steamroller,1995,"From the album Christmas in the Aire. First recorded by The Trinity Choir in 1911.[323] Also released by Mariah Carey (1995),[324] and Faith Hill (2008).[325] A 2015 version by Pentatonix peaked at No. 9 on the Billboard Adult Contemporary chart in 2015.[326]"
328,a joyful noise,Jo Dee Messina,2002,From the album A Joyful Noise. Peaked at No. 16 on the Adult Contemporary chart.[278]
329,just put a ribbon in your hair,Alan Jackson,2004,From the various artists album A Very Special Acoustic Christmas.[76]
330,the kid,Clint Black,1995,"Peaked at No. 71 on the Billboard Hot Country Singles & Tracks chart in 1996, at No. 67 on the same chart in 1999, and at No. 71 on the same chart in 2000. Taken from Black's 1995 holiday album, Looking for Christmas.[135][327]"
331,the kid in me,Craig Morgan,2000,Peaked at No. 68 on the Billboard Hot Country Singles & Tracks chart.[87][328]
332,a kiss for christmas ,Joe Dowell,1961,New lyrics set to the melody of an old German folk song. Peaked at No. 110 on the Billboard Bubbling Under Hot 100 Singles chart.[51][329]
333,kissin' by the mistletoe,Aretha Franklin,1961,"Appeared in the ""Music Vendor"" Christmas chart of 1963."
334,last christmas,Wham!,1984,"Written by George Michael and first released in the United Kingdom on December 3, 1984, where it peaked at No. 2 on the UK Singles Chart later that same month.[330] First released in the United States as the final track on Wham!'s 1986 studio album, Music from the Edge of Heaven. Made its first appearance on a U.S. music chart on Billboard's Hot 100 Airplay chart on the week ending January 3, 1998, peaking at No. 58 one week later (the same week it also entered and peaked at No. 22 on Billboard's Adult Contemporary chart).[55] First entered Billboard's main Hot 100 chart on the week ending January 7, 2017, eventually peaking at No. 9 on the week ending January 2, 2021, following its fourth chart re-entry. Also made these other Billboard music charts (with peak positions shown): Adult Top 40 (No. 40), Digital Song Sales (No. 13), Global 200 (No. 2), Holiday 100 (No. 3), Holiday Airplay (No. 4), Holiday Digital Song Sales (No. 2), Holiday Streaming Songs (No. 6), Hot 100 Recurrents (No. 3), Radio Songs (No. 34), and Streaming Songs (No. 7).[331] Rumored to have been written for Easter, but later changed to Christmas to boost sales."
340,leroy the redneck reindeer,Joe Diffie,1995,Reached No. 33 on the Country charts in 1996.[51][347][164] From the album Mr. Christmas.
341,let it be christmas,Alan Jackson,2002,Reached No. 37 on the Billboard Hot Country Singles chart in 2002. From the album Let It Be Christmas.[76][348]
342,let it snow,Boyz II Men,1993,"Co-written and co-produced by R&B singer Brian McKnight, who also provides guest vocals on the track. Not the same song as ""Let It Snow! Let It Snow! Let It Snow!"".[72][349]"
343,let it snow! let it snow! let it snow!,Vaughn Monroe and His Orchestra,1945,"Featuring backing vocals by the Norton Sisters. Spent six weeks at No. 1 on the Billboard Records Most-Played On The Air chart, five weeks at No. 1 on the Billboard Best-Selling Popular Retail Records chart, and five weeks at No. 1 on the Billboard Most-Played Juke Box Records chart in January and February 1946.[87] Written by Sammy Cahn and Jule Styne.[87][350]"
358,let's light the christmas tree,Ruby Wright,1957,Hit various pop charts in Billboard and Music Vendor.[272]
359,let's make a baby king,Wynonna Judd,1994,From the album Tell Me Why.[272][366]
360,let's make christmas mean something this year,James Brown,1967,"Narrated by Brown, with female backing vocals by The Charmaines.[158]"
361,"let's make christmas merry, baby",Amos Milburn and his Aladdin Chicken-Shackers,1949,A hit on Billboard magazine's R&B Best Seller and Juke Box singles chart in 1949.[278][367][368]
362,let's start the new year right,Bing Crosby,1943,With the Bob Crosby orchestra. From the 1942 film Holiday Inn.[189]
363,let the season take wing,Amy Grant,1992,Single available only as a cassette. Packaged with the Amy Grant album Home For Christmas at Target stores in 1992.
364,light of the stable,Emmylou Harris,1975,"Featuring backing vocals by Dolly Parton, Linda Ronstadt and Neil Young.[186]"
365,like it's christmas,Jonas Brothers,2019,Peaked at No. 1 on the Billboard Adult Contemporary chart for three straight weeks in December 2019. Also peaked at No. 44 on the Billboard Hot 100 chart in late December 2019/early January 2020.
366,li'l elfy,Ray Bolger,1963,With the Gene Garf orchestra; charted for one week on the Billboard Christmas charts.[147]
367,little altar boy,Vic Dana,1961,"With the Hank Levine orchestra. Charted again in 1965.[113][369] Not explicitly a Christmas song, its inclusion on Christmas albums by Jack Jones, Andy Williams, Glen Campbell and (posthumously) the Carpenters established it as a Christmas song."
368,little becky's christmas wish,Becky Lamb,1967,"Spoken-word record featuring a little girl who narrates a letter to Santa Claus about her brother Tommy, who is killed in Vietnam. Quite controversial at the time, the record went to No. 2 on the Billboard Christmas chart despite the fact many radio stations refused to play it. Little is known about Becky except for the fact that she was five years old at the time of the recording; the B-side, ""Go to Sleep Little Lambs"" is credited to Bill Lamb, presumably Becky's father.[173]"
369,the little boy that santa claus forgot,Vera Lynn,1937,Covered by Nat King Cole in 1953. Sung on-screen by James Belushi in film Jingle All The Way.
370,the little drummer boy ,Harry Simeone Chorale,1958,"Written in 1941 by Katherine K. Davis.[53][370] A version by Lou Rawls peaked at No. 2 on Billboard magazine's special Christmas Singles chart in 1967 (it charted again in 1969).[354] Other charted versions include Johnny Cash (1959),[15] Johnny Mathis (1963),[47] Joan Baez (1966),[143] Kenny Burrell (1967),[91] RuPaul (1994),[128] Restless Heart (1999),[354] Josh Groban (2007),[371] Wilson Phillips (2010), Richard Marx (2012), Pentatonix (2013),[372] and for KING & COUNTRY (2017). A version by the Vienna Boys Choir also hit big when it was featured in the Rankin/Bass animated TV special of the same name."
371,little saint nick,The Beach Boys,1963,"Reached No. 3 on the Billboard Christmas singles chart.[143][373] Covered by Hanson (1997), Sugar Ray (2001) and She & Him (2011). Also featured in the 1979 TV special John Denver and the Muppets: A Christmas Together."
372,little sandy sleighfoot,Jimmy Dean,1957,Novelty song performed with the Ray Ellis Orchestra.[113][374]
373,lonesome christmas,Lowell Fulson,1950,"Originally charted on the R&B charts, hit the Christmas singles chart in 1964–1968 and 1970.[131]"
374,love for christmas,Felix Gross and his Orchestra,1949,Reached No. 9 on the Hot R&B Singles chart. Featured Tiny Webb on guitar and Joe Howard on tenor sax.[186]
375,love is,Leza Miller,1967,"Charted for 2 weeks on the Christmas Singles chart, peaking at No. 20. B-side is ""Loneliest Christmas Tree"".[278]"
376,love on layaway,Gloria Estefan,2000,Included on the 2001 album Now That's What I Call Christmas!.
377,macarena christmas,Los del Río,1996,"Dance record ""Macarena"", mixed with a melody of holiday songs, including ""Joy to the World"", ""Jingle Bells"", ""Silent Night"", ""Rudolph the Red-Nosed Reindeer"", ""White Christmas"", and ""Auld Lang Syne"".[34][375]"
378,the man with all the toys,The Beach Boys,1964,Reached No. 6 on the Billboard Christmas chart in 1964.[143][376]
379,marshmallow world,Bing Crosby,1950,Lyrics written by Carl Sigman and music composed by Peter De Rose.[189][377] Also recorded by Darlene Love for the classic 1963 holiday album A Christmas Gift for You from Phil Spector. Other popular versions recorded by Brenda Lee in 1964 and Dean Martin in 1966.
380,the marvelous toy,Chad Mitchell Trio,1963,"Written by Tom Paxton.[87] Peter, Paul & Mary released a version in 1969. A folk favorite, also recorded by The Irish Rovers and John Denver."
381,"mary, did you know",Kenny Rogers with Wynonna,1996,"Lyrics written in 1984 by Mark Lowry. Buddy Greene composed the music in 1990.[128][378] The song was first released on the album Michael English in 1992.[379] Also a hit for Kathy Mattea (1993), Natalie Cole (1999), Reba McEntire (1999), Clay Aiken (2005),[380] Michael Bublé, Pentatonix (2014),[381] Jordan Smith, and others."
382,mary's boy child,Harry Belafonte,1956,"Written by Jester Hairston.[143][382] Also a top 40 hit remake in the UK for Nina & Frederick in 1959, and a No. 1 hit remake in the UK for Boney M in 1978, as a medley titled ""Mary's Boy Child/Oh My Lord"".[147]"
383,may christmas bring you happiness,Luther,1976,"1970s R&B vocal quintet featuring Luther Vandross on lead vocals, along with former Shades of Jade members Anthony Hinton and Diane Sumler, Theresa V. Reed, and Christine Wiltshire."
384,may you always,Harry Harrison,1965,"Spoken-word recording accompanied by ""Auld Lang Syne"" as its instrumental backing that peaked at No. 26 on Billboard's Top Christmas Singles chart on the week ending December 25, 1965.[186] Not to be confused with the popular song of the same title. Harrison was a New York City-based radio personality and disc jockey."
385,mele kalikimaka ,Bing Crosby with The Andrews Sisters,1950,"This Hawaiian-themed Christmas song debuted on Billboard's Hot 100 chart at No. 36 on the week ending January 2, 2021. Also made these other Billboard music charts (with peak positions shown): Digital Song Sales (No. 47), Holiday 100 (No. 25), Holiday Digital Song Sales (No. 22), Holiday Streaming Songs (No. 22), Hot 100 Recurrents (No. 5), and Streaming Songs (No. 22).[383]"
387,merry christmas,Judy Garland,1949,"Written by Janice Torre and Fred Spielman, for the 1949 MGM musical film In the Good Old Summertime. Later recorded by Johnny Mathis (2002) and Bette Midler (2006)."
388,merry christmas ,The Ramones,1987,"B-side of single ""I Wanna Live""."
389,"merry christmas, baby",Johnny Moore's Three Blazers,1947,"The original version by Johnny Moore's Three Blazers peaked at No. 3 on Billboard magazine's R&B Juke Box chart during the Christmas season of 1947.[385] Charles Brown was the singer and pianist of Johnny Moore's Three Blazers. Brown also recorded a hit solo remake of the song in 1956.[158] Other versions that also charted were by Chuck Berry in 1958,[135][386] and by Otis Redding in 1968.[354] Bruce Springsteen also recorded a live version from a 1980 concert (first released in 1986 as a B-side)[387] that was made popular following its inclusion on the 1987 Special Olympics charity album A Very Special Christmas."
390,merry christmas darling,The Carpenters,1970,"Re-charted in 1971, 1972, 1973, and 1983.[15][388] Re-released in 1978 with newly recorded vocals for their 1978 holiday album Christmas Portrait.[389] Also a hit for Vanessa L. Williams in 2004.[390]"
391,merry christmas everybody,Train,2015,Peaked at No. 10 on the Billboard Adult Contemporary chart.[391] First recorded by the English rock band Slade in 1973.
392,merry christmas from the family,Robert Earl Keen,1994,From the album Gringo Honeymoon. A version by Montgomery Gentry also charted at No. 38 on Hot Country Songs in 2001.[87][392]
393,"merry christmas, happy holidays",'N Sync,1998,Hit the Top 40 Mainstream chart in 1999.[100]
394,merry christmas in the nfl,Buckner & Garcia,1980,"Novelty song which imagined Howard Cosell as Santa Claus. Performed under the pseudonym ""Willis the Guard & Vigorish"", the song reached No. 82 on the Billboard charts, despite limited airplay after Cosell found the song offensive.[85]"
395,merry christmas strait to you,George Strait,1986,"First released on Strait's 1986 holiday album Merry Christmas Strait to You, but the title track didn't hit the Billboard Hot Country Singles chart until 1998.[145][393]"
396,merry merry christmas baby,Dodie Stevens,1960,Covered by Margo Sylvia in 1994.
397,merry merry merry frickin' christmas,Frickin' A,2004,Two versions of the song. One is a tribute to the Boston Red Sox on their winning of the 2004 World Series. The other is a satire of spending time with the family.
398,merry twistmas,The Marcels,1961,"Written to capitalize on the U.S. dance craze called ""The Twist""."
399,mistletoe ,Colbie Caillat,2007,"Peaked at No. 75 on the Billboard Hot 100 singles chart and No. 44 on the Billboard Pop 100 chart in late 2007, and No. 7 on the Billboard Hot Adult Contemporary Tracks chart in early 2008.[394]"
400,mistletoe ,Justin Bieber,2011,"Peaked at No. 11 on the Billboard Hot 100 singles chart, No. 5 on Billboard's Hot Digital Songs chart in 2011. Also peaked at No. 4 on Billboard's Adult Contemporary Tracks.[395]"
401,mistletoe and holly,Frank Sinatra,1957,"Written by Frank Sinatra, Doc Stanford & Hank Sanicola. Selected as the theme song for the 1960 Christmas Seals appeal.[396]"
402,the mistletoe and me,Isaac Hayes,1969,Charted again in 1973.[264]
403,monsters' holiday,Bobby (Boris) Pickett and the Crypt-Kickers,1962,"Similar to Pickett's No. 1 pop hit single from earlier in 1962, ""Monster Mash"".[1][397]"
404,the more you give ,Michael Bublé,2015,Peaked at No. 19 on the Billboard Adult Contemporary chart in early 2016.
405,mr. hankey the christmas poo,South Park,1997,"Song debuted in the South Park episode of the same name, has appeared in several others since."
406,must be santa,Lorne Greene with the Jimmy Joyce Children's Choir,1966,Written by Hal Moore and Bill Fredricks. First recorded by Mitch Miller and the Gang in 1961. Also covered by Bob Dylan in 2009.
407,my boyfriend's coming home for christmas,Toni Wine,1963,"Includes elements of ""The First Noel"".[85]"
408,my christmas card to you,The Partridge Family,1971,Written by Tony Romeo. From the Billboard #1 Christmas album of 1971 A Partridge Family Christmas Card.
409,my favorite things,Herb Alpert & the Tijuana Brass,1968,"Originally written for the 1959 Broadway musical The Sound of Music. Charted for Herb Alpert and the Tijuana Brass, reaching No. 7 on the Billboard Easy Listening chart, #35 on the Cash Box Top 100, and #45 on the Billboard Hot 100 in early 1969.[2][398] Popular versions that charted include a minor hit for Lorrie Morgan in 1994,[87][399] a version by the band Chicago in 2001, and Kenny G in 2005.[400]"
410,my mom and santa claus,George Jones,1965,First released in 1962; charted for one week on the Billboard Christmas charts in 1965.[10]
411,my only wish ,Britney Spears,2000,Reached No. 7 on the Christmas Songs chart.[401]
412,natividad ,Harvie June Van,1967,First released on Briar Records in 1962. Re-issue on Kapp Records peaked at No. 15 on Billboard's Christmas Singles chart.[13]
413,new year's eve 1999,Alabama with Gretchen Peters,1999,Peaked at No. 55 on Billboard's Hot Country Singles & Tracks chart in early 2000.[39]
414,a new york christmas,Rob Thomas,2003,Peaked at No. 22 on Billboard's Hot 100 Singles Sales chart.[12]
415,the night before christmas ,Milton Cross,1939,"Peaked at No. 6 on Billboard's Best-Selling Children's Records chart in 1948. Recitation of Clement Moore's famous 1823 poem ""A Visit from St. Nicholas"" with musical background orchestrated by Victor Salon. Originally released in 1939.[189] A version by Jim Brickman featuring John Oates peaked at No. 5 on Billboard's Adult Contemporary chart in 2014.[402]"
416,the night before christmas ,Carly Simon,1992,Written and recorded by Simon for the 1992 film This Is My Life; also used in the 1994 film Mixed Nuts. Covered by Amy Grant in 1992.
417,the night before christmas song,Rosemary Clooney & Gene Autry,1952,"Peaked at No. 9 on Billboard's Top Popular Records – Most Played by Jockeys chart in late December 1952.[214][403] A recording of Clement Moore's famous 1823 poem ""A Visit from St. Nicholas"" featuring a melody written by Johnny Marks and orchestration by Carl Cotner."
418,the night santa went crazy,"""Weird Al"" Yankovic",1996,"Parody of Greg Lake's ""I Believe in Father Christmas"" in the style of Soul Asylum's ""Black Gold"".[404] Two versions were recorded."
419,nina-non,Joni James,1953,Featuring orchestra and chorus conducted by Lew Douglas.
420,a not so merry christmas,Bobby Vee,1962,From the album Merry Christmas from Bobby Vee.
421,the nutcracker suite,Arthur Fiedler and the Boston Pops,1958,"Also a hit for the Berlin Symphony Orchestra and many others around the world. Introduced in a stylized jazz-big band version by Les Brown in the 1957 album Concert Modern. Other hit rock versions by The Brian Setzer Orchestra and Trans-Siberian Orchestra. Latter's version retitled ""A Mad Russian's Christmas""."
422,nuttin' for christmas,Art Mooney and His OrchestraVocal by Barry Gordon,1955,"Peaked at No. 6 on Billboard's Popular Records – Best Sellers in Stores chart in 1956.[93][405] Versions by four other artists charted in December 1955 and early 1956 on one or more of Billboard's music popularity charts: Joe Ward,[13] Ricky Zahnd & The Blue Jeaners (titled ""(I'm Gettin') Nuttin' for Christmas""),[272] The Fontane Sisters,[74][406] and Stan Freberg.[131] Written by Sid Tepper and Roy C. Bennett. Eartha Kitt released a version in 1955 with different lyrics titled ""Nothin' for Christmas"" with the same writer credits. Also covered by the rock group Smash Mouth."
423,o bambino ,Harry Simeone Chorale,1964,"Peaked at No. 9 on Billboard's Christmas Singles chart. Charted again on the Christmas Singles chart and Billboard's Bubbling Under Hot 100 Singles chart in 1965.[53][407] Introduced in 1961 by The Springfields as ""Bambino (Napoli Lullaby)"". Same melody as ""Bagpiper's Carol"" by The Mariners."
424,o come all ye faithful,Twisted Sister,2006,"Performed in the style of their hit ""We're Not Gonna Take It"", while staying faithful to the carol's original words and melody."
425,o holy night,John Berry,1995,"Peaked at No. 55 on Billboard's Hot Country Singles & Tracks chart in 1996.[135][408] A 19th-century French carol, originally titled ""Cantique de Noël."" First known recorded version was released in 1916 by Enrico Caruso. First appearance on a popular Christmas album was in 1946 by Fred Waring. Other charted versions were by Martina McBride (1996),[47][409] Celine Dion (1998),[410] Josh Groban (2002),[186][411] LeAnn Rimes (2003),[354][412] Clay Aiken (2004),[413] Carrie Underwood (2009),[414] Newsboys (2010), and Richard Marx (2012). Dion's version was featured as the leading song to her popular 1998 album These Are Special Times.[415]"
426,o little town of bethlehem,Jo Stafford,1964,"On her album, ""The Joyful Season"", it features Stafford accompanying herself as a vocal choir through the use of multitrack recording."
427,o tannenbaum,Vince Guaraldi Trio,1965,Originally composed by Ernst Anschütz and performed by the Vince Guaraldi Trio for the 1965 animated TV special A Charlie Brown Christmas. A version by Aretha Franklin appeared on the 1992 album A Very Special Christmas 2.
