,title,artist,year,info
1,a' soalin',"Peter, Paul and Mary",1963,"From the album Moving. Written by Paul Stookey, Tracy Batteste & Elaina Mezzetti. Contains an element of ""God Rest Ye Merry, Gentlemen"".[1]"
2,adeste fideles,Associated Glee Clubs of America,1925,"Peaked at No. 5 on the Billboard pop singles chart in 1925. This historic record was the first electrically recorded disc to create a popular impact, and featured the largest choir popular music has ever known: some 4,800 voices (according to Columbia Records).[2] Over 150 versions of this standard have appeared in Christmas LPs since 1946."
4,all alone on christmas,Darlene Love,1992,Peaked at No. 83 on the Billboard Hot 100 singles chart in 1993. From the 1992 film Home Alone 2: Lost in New York.[5][6]
5,all i really want for christmas,Steven Curtis Chapman,2005,Peaked at No. 2 on the Billboard Christian Songs chart in 2006.[7] From the album All I Really Want for Christmas.
6,all i want for christmas is a real good tan,Kenny Chesney,2003,Peaked at No. 30 on Billboard's Hot Country Singles & Tracks chart.[8][9] From the album All I Want for Christmas Is a Real Good Tan.
7,all i want for christmas is my two front teeth,Spike Jones and his City Slickers,1948,Spent three weeks at No. 1 on Billboard's Records Most Played by Disk Jockeys chart in 1948 and 1949. Also peaked at No. 14 on Billboard's Children's Records chart and No. 18 on Billboard's Best-Selling Pop Singles chart in 1950.[10][11] Written by Donald Yetter Gardner.
8,all i want for christmas is you ,Carla Thomas,1963,"Originally released as the B-side of Thomas's 1963 holiday hit, ""Gee Whiz, It's Christmas"". A new version recorded by Thomas peaked at No. 11 on Billboard's Christmas Singles chart in 1966.[12]"
9,all i want for christmas is you ,Vince Vance & The Valiants,1989,"First released as a single in 1989, but didn't become a country radio chart hit until 1993. Re-charted in 1994–1997. Peaked at No. 31 on Billboard's Hot Country Singles & Tracks chart in 1999.[13][14] Melody is the same as Bobby Vinton's 1964 top 10 pop hit, ""My Heart Belongs to Only You""."
10,all i want for christmas is you ,Mariah Carey,1994,"Peaked at No. 12 on Billboard's Radio Songs chart and No. 6 on Billboard's Adult Contemporary chart on the first week of January 1995,[15] and three weeks at No. 1 on the Billboard Hot 100 chart in December 2019 into early January 2020.[16] Written by Walter Afanasieff and Mariah Carey."
15,all my love for christmas,Lonestar,1998,Peaked at No. 61 on Billboard's Hot Country Singles & Tracks chart in 1999.[34][35] From the 1998 various artists album Country Christmas Classics on RCA Records.
16,amen,The Impressions,1964,"Featured in the 1963 film Lilies of the Field. Peaked at No. 7 on Billboard's Hot 100 singles chart on the week ending January 9, 1965, and at No. 17 on Billboard's Hot Rhythm & Blues Singles chart on the week ending January 30, 1965. An updated recording by the group titled ""Amen (1970)"" was released in November 1969, peaking at No. 44 on Billboard's Best Selling Soul Singles chart on the week ending January 10, 1970, and at No. 110 on Billboard's Bubbling Under The Hot 100 chart on the week ending January 3, 1970.[36][37]"
18,angels among us,Alabama,1993,"Reached No. 51 on Billboard's Hot Country Singles & Tracks chart from unsolicited airplay, as a partial Christmas single from the band's album Cheap Seats. Charted again in 1994 and 1995.[39][40]"
19,angels we have heard on high,Sonicflood,2003,"Traditional French carol known as Les Anges dans nos campagnes translated to English in 1862 by James Chadwick. Peaked at No. 21 on the Billboard Christian Songs chart in 2004. Chris Tomlin also had a hit version on the Christian Songs chart in 2006, peaking at No. 5.[41]"
20,another lonely christmas,Prince and The Revolution,1984,"Peaked at No. 5 on Billboard's Christmas Singles chart. Originally released as the B-side of Prince and The Revolution's 1984 single ""I Would Die 4 U"".[38]"
21,auld lang syne,Peerless Quartet,1921,Peaked at No. 5 on one of the top-selling music charts in December 1921.[1][42] Written by Robert Burns as a Scots-language poem in 1788[43][44] and set to the tune of a traditional folk song (Roud no. 6294).
24,away in a manger,Reba McEntire,1987,"Peaked at No. 73 on Billboard's Hot Country Singles & Tracks chart on the week ending January 9, 1999.[47][48] From her 1987 holiday album Merry Christmas to You."
27,babes in toyland/march of the toys,Tommy Dorsey Orchestra,1939,Written by Victor Herbert and Glen MacDonough.[51] Popular by Arthur Fiedler and the Boston Pops orchestra (1958). Later recorded by Doc Severinsen and the Tonight Show Orchestra (1991).
28,a baby changes everything,Faith Hill,2008,"Spent three weeks at No. 1 on Billboard's Hot Adult Contemporary Tracks chart.[52] From Hill's first Christmas album, Joy to the World."
29,"baby, it's cold outside",Dinah Shore & Buddy Clark,1949,"With orchestra under the direction of Ted Dale. Written in 1944 by Frank Loesser. From the 1949 film Neptune's Daughter starring Esther Williams and Red Skelton. Peaked at No. 3 on the Billboard Records Most Played By Disk Jockeys chart, at No. 4 on the Billboard Best-Selling Popular Retail Records chart, and at No. 6 on the Billboard Most-Played Juke Box Records chart in mid 1949.[53][54]"
39,baby jesus is born,Garth Brooks,1999,Peaked at No. 62 on the Billboard Hot Country Singles & Tracks chart.[72][73]
40,baby's first christmas,Connie Francis,1961,"Featuring the Don Costa Orchestra. Peaked at No. 7 on Billboard's Middle-Road Singles chart and No. 24 on the Billboard Hot 100 singles chart in 1961, and at No. 13 on Billboard's Christmas Singles chart in 1965.[74][75]"
41,back door santa,Clarence Carter,1968,"Released on the 1968 various artists holiday soul album Soul Christmas.[15] Also recorded by Bon Jovi for the 1987 various artists holiday compilation A Very Special Christmas (though it was removed from later pressings), and sampled by Run-D.M.C. for their hit, ""Christmas in Hollis"" (which was also included on A Very Special Christmas)."
42,barefoot santa claus,Sonny James (The Southern Gentleman),1966,Peaked at No. 9 on Billboard's Christmas Singles chart. Charted again in 1968. Features a children's chorus on backing vocals. From the album My Christmas Dream.[76]
43,because it's christmas ,Barry Manilow,1990,"Peaked at No. 38 on the Billboard Hot Adult Contemporary Tracks chart in 1991.[5][77] From Manilow's first Christmas album, Because It's Christmas."
44,believe,Josh Groban,2004,"Peaked at No. 1 for five weeks on the Billboard Hot Adult Contemporary Tracks chart, and ""Bubbled under"" the Billboard Hot 100 chart with a peak position of #112.[78] From the 2004 film The Polar Express."
45,the bell that couldn't jingle,Bobby Vinton,1964,"Written by Burt Bacharach and Larry Kusik. Paul Evans, Bobby Helms, Herb Alpert, Anita Kerr, and Bacharach each recorded the song as well, but only Vinton's version charted, reaching No. 23 on the Billboard Christmas Singles chart.[13]"
46,belleau wood,Garth Brooks,1997,Peaked at No. 41 on Billboard Hot Country Singles & Tracks chart in 1998. From Brooks's album Sevens.[72][79]
47,the bells of st. mary's,Bing Crosby,1945,"Written by A. Emmett Adams and Douglas Furber in 1917.[80] While the song has no lyrical relation to Christmas, its inclusion in the 1945 film of the same name has made it a popular choice for various artists' holiday albums."
48,better days,Goo Goo Dolls,2006,"Despite its overtly Christian tone and obvious references to Christmas, this song managed to reach No. 3 on the Billboard Hot Adult Top 40 Tracks chart, and remains in regular rotation on hot adult top 40 stations.[81]"
49,the blessings,Alabama,1996,Peaked at No. 72 on the Billboard Hot Country Singles & Tracks chart in 1997.[39][82]
50,blue christmas,Ernest Tubb,1949,"Peaked at No. 1 on Billboard's Most-Played Juke Box (Country & Western) Records chart in the issue dated January 7, 1950. Also made these other Billboard music charts in December 1949 (with peak positions shown): Best-Selling Retail Folk (Country & Western) Records (No. 2), Country & Western Records Most Played by Folk Disk Jockeys (No. 2), Records Most Played by Disk Jockeys (No. 23), and Most Played Juke Box Records (No. 26).[83][84] Written as a country song by Billy Hayes and Jay W. Johnson in 1948, and first recorded by Doye O'Dell that year. Ranks as the all-time number one holiday single on Billboard's Hot Country Songs chart."
59,blue december,Hugo Winterhalter and his Orchestra,1951,Peaked at No. 18 on Billboard's Records Most Played by Disk Jockeys chart in early 1952.[85][98]
60,blue holiday,The Shirelles,1961,"Written by Willie Denson and Luther Dixon and recorded by The Shirelles in 1961. Later recorded by Aretha Franklin, and appeared in the 2002 film The Santa Clause 2.[99]"
61,blue lonely winter,Jimmy Newman,1967,Peaked at No. 11 on Billboard's Hot Country Singles chart in 1968.[100][101]
62,blue winter,Connie Francis,1964,Peaked at No. 24 on the Billboard Hot 100 singles chart and No. 7 on the Billboard Middle-Road Singles chart in March 1964.[74][102]
63,boogie woogie santa claus,Mabel Scott,1948,"Peaked at No. 12 on Billboard's Race Records chart.[103][104] Written by Leon René. Other versions recorded by Patti Page (1950), Inner Voices (1994), Dave Koz (2001), the Brian Setzer Orchestra (2002) and Brenda Russell (2003)."
64,breath of heaven ,Amy Grant,1992,From the album Home For Christmas.[105]
65,call me claus,Garth Brooks,2001,"Peaked at No. 22 on the Billboard Hot 100 sales chart in October 2001, and later reached No. 55 on the Hot Country Singles & Tracks chart in 2002. Title song from the TV movie starring Whoopi Goldberg.[72][106]"
66,candy cane children,The White Stripes,2002,
67,candy cane christmas,Darius Rucker,2009,"Peaked at No. 16 on the Billboard Adult Contemporary chart, and No. 32 on the Country chart in 2010.[107] Originally released on the various-artists CD Now That's What I Call Christmas! 4 in 2010, and later on Rucker's 2014 album Home for the Holidays."
68,carol of the bells,John Tesh,1997,Peaked at No. 20 on Billboard's Hot Adult Contemporary Tracks chart in 1998.[12] A version by Kim Walker-Smith peaked at No. 13 on Billboard's Adult Contemporary chart in 2014.[108]
69,"caroling, caroling",Nat King Cole,1960,"Written by Alfred Burt & Wihla Hutson.[109] Also recorded by Natalie Cole, Tennessee Ernie Ford, and the King Family."
70,celebrate me home,Kenny Loggins,1977,"Title track of Loggins' 1977 debut solo album. Released as a single, the studio version reached No. 64 on the US Record World pop chart in the spring of 1978.[110] A 2015 version by LeAnn Rimes featuring Gavin DeGraw peaked at No. 12 on the Billboard Adult Contemporary chart in 2015.[111]"
71,cherry cherry christmas,Neil Diamond,2009,"Peaked at No. 4 on Billboard's Adult Contemporary chart.[112] First single released from and title track on Diamond's third holiday album, A Cherry Cherry Christmas."
72,child of god,Bobby Darin,1960,"Peaked at No. 95 on the Billboard Hot 100 singles chart.[113][114] B-side of Darin's hit single ""Christmas Auld Lang Syne""."
73,child of winter,The Beach Boys,1974,
74,"children, go where i send thee",Kenny Rogers featuring Home Free,2015,Peaked at No. 21 on Billboard's Hot Christian Songs chart in 2016. Another version by John Oates peaked at No. 29 on Billboard's Adult Contemporary chart in 2017.
75,children's christmas song,The Supremes,1965,Peaked at No. 7 on Billboard's Christmas Singles chart. Features a children's chorus on backing vocals.[115]
76,the chipmunk song ,The Chipmunks,1958,"Spent four weeks at No. 1 on the Billboard Hot 100 singles chart in 1958, and reached No. 5 on Billboard's Hot R&B Sides chart in 1959.[8][116] Written by Ross Bagdasarian (a.k.a. David Seville). The most popular novelty Christmas single in the U.S. through the 1960s. Launched a 50-year music career for the fictional character group."
77,c-h-r-i-s-t-m-a-s,"Eddy Arnold, the Tennessee Plowboy and his Guitar",1949,Peaked at No. 7 on Billboard's Country & Western Records Most Played by Folk Disk Jockeys charts.[2][117] Written by Eddy Arnold & Jenny Lou Carson. Also recorded by the Ames Brothers and Jim Reeves.
78,christmas ain't christmas ,The O'Jays,1969,"Written and produced by Kenny Gamble and Leon Huff. The song's original title was the longer ""(Christmas Ain't Christmas New Year's Ain't New Year's) Without the One You Love"". Reissued by the group's record label (Philly International) in 1973 following the group's huge success."
79,christmas all over again,Tom Petty and the Heartbreakers,1992,From the 1992 album A Very Special Christmas 2.[118] Subsequently featured later that year in the 1992 film Home Alone 2: Lost in New York.
80,christmas alphabet,The McGuire Sisters,1954,Peaked at No. 25 on the popular records chart. Features orchestration by Dick Jacobs.[47][119]
81,christmas at ground zero,"""Weird Al"" Yankovic",1986,
82,christmas at k-mart,Root Boy Slim,1978,
83,christmas at the zoo,The Flaming Lips,1995,"From the album Clouds Taste Metallic. Not intended to be a Christmas song, though the characteristic ""jingling bells"" are featured in the song, as well as talk of the holiday."
84,christmas auld lang syne,Bobby Darin,1960,"Peaked at No. 51 on the Billboard Hot 100 singles chart in 1961.[113][120] The B-side ""Child of God"" also charted for one week in 1960."
85,christmas ,Darlene Love,1963,"Included on the 1963 holiday album A Christmas Gift for You from Phil Spector. Written by Phil Spector, Ellie Greenwich, and Jeff Barry. First entered Billboard's Hot 100 chart on the week ending December 29, 2018, peaking at No. 19 on the week ending January 2, 2021 (following its second chart re-entry). Also made these other Billboard music charts (with peak positions shown): Global 200 (No. 30), Holiday 100 (No. 13), Holiday Airplay (No. 42), Holiday Digital Song Sales (No. 21), Holiday Streaming Songs (No. 11), Hot 100 Recurrents (No. 4), R&B Digital Song Sales (No. 6), R&B Streaming Songs (No. 3), R&B/Hip-Hop Digital Song Sales (No. 16), R&B/Hip-Hop Streaming Songs (No. 4), and Streaming Songs (No. 15).[121]"
88,christmas blues,Canned Heat,1968,Peaked at No. 18 on the Billboard Christmas Singles chart.[91] Also released as a single by The Chipmunks.
89,the christmas blues,Dean Martin,1953,Written by David Holt and Sammy Cahn. Also recorded by Jo Stafford.
90,christmas canon,Trans-Siberian Orchestra,1998,Chord progression is based on that of Pachelbel's Canon in D major.[124]
91,christmas can't be far away,Eddy Arnold and his Guitar,1954,Peaked at No. 12 on Billboard's Country & Western Records Most Played by Jockeys chart in 1955.[2][125]
92,christmas can't be very far away,Amy Grant,1999,"Not to be confused with ""Christmas Can't Be Far Away"" by Eddy Arnold."
93,christmas carol,Skip Ewing,1990,"Written in 1986 and first released on Ewing's 1990 album Following Yonder Star. First charted on Billboard's Hot Country Singles & Tracks chart in 1996, peaking at No. 68.[126][127]"
94,christmas carols by the old corral,Tex Ritter,1945,Peaked at No. 2 on Billboard's Most-Played Juke Box Folk Records chart.[128][129]
95,christmas celebration,B. B. King,1963,"First charted on Billboard's Christmas Singles chart in 1964, peaking at No. 25. Charted again in 1967, peaking at No. 17.[45]"
96,christmas c'mon,Lindsey Stirling featuring Becky G,2017,Peaked at No. 21 on the Billboard Adult Contemporary chart.
97,christmas ,Amos Milburn,1960,"Originally released as the B-side of Charles Brown's 1960 holiday hit single, ""Please Come Home for Christmas""."
98,christmas cookies,George Strait,2001,From the 2001 various artists album Christmas Cookies. Peaked at No. 33 on Billboard's Hot Country Singles & Tracks chart in 2002.[115][130] Originally issued on the Target CD A Country Christmas 1999.
99,christmas day,Eddie Fisher,1952,Peaked at No. 22 on the popular records chart. Features Hugo Winterhalter and his orchestra.[57] Written by Benny Davis and Ted Murry. Released within a four-record album set titled Christmas with Eddie Fisher.
100,christmas dinner,Tennessee Ernie Ford,1951,"B-side is ""A Rootin' Tootin' Santa Claus""."
101,christmas dragnet ,Stan Freberg with Daws Butler,1953,"Peaked at No. 13 on Billboard's Best Selling Singles chart.[131][132] A parody of Dragnet and the follow-up to Freberg's No. 1 hit from several months earlier, ""St. George and the Dragonet"". In 1954, the same record was re-issued under the title ""Yulenet (Parts I & II)""."
102,christmas dream,Perry Como,1974,Peaked at No. 92 on the Billboard Hot 100 singles chart. From the 1974 film The Odessa File.[96][133] Como's last appearance on the Billboard Hot 100.
103,christmas dreaming ,Frank Sinatra,1947,Peaked at No. 26 on the Billboard Pop Charts. Featuring the Axel Stordahl orchestra.[53]
104,christmas eve,Kelly Clarkson,2017,Peaked at No. 2 on the Billboard Adult Contemporary chart in early 2018.
105,christmas eve in my hometown,Bobby Vinton,1970,Earlier recordings by Eddie Fisher and Kate Smith.
106,christmas eve/sarajevo 12/24,Savatage,1996,"The song is a medley including ""God Rest Ye Merry, Gentlemen"" and a hard rock version of ""Carol of the Bells"". First released in 1995 on the Savatage album Dead Winter Dead, but the same recording was re-released in 1996 as a track on the Trans-Siberian Orchestra album Christmas Eve and Other Stories.[83]"
107,christmas for cowboys,John Denver,1975,From the album Rocky Mountain Christmas. Written by Steve Weisberg. Peaked at No. 58 on the Billboard Hot 100 chart.[113][134]
108,christmas in america,Pat Benatar,2001,Reached No. 22 on the Billboard Adult Contemporary chart and No. 37 on the Billboard Hot 100.[135][136] Later appeared on the 2003 album Go as a hidden track.
109,christmas in dixie,Alabama,1982,"The original version featured Alabama wishing you ""Merry Christmas"" near the end of the song. Lead singer Randy Owen re-recorded the song with Kenny Chesney in 2003.[39][137]"
110,christmas in hollis,Run-D.M.C.,1987,"An original song written and recorded by the group for charity, with the music video a perennial favorite on the MTV through the late 1980s and 1990s. It first appeared on two 1987 various artist holiday compilation albums: A Very Special Christmas and Christmas Rap, with the former album to benefit the Special Olympics. The track samples the 1968 soul tune ""Back Door Santa"" by Clarence Carter.[128][138]"
111,christmas in killarney,Dennis Day,1950,"Featuring the Mellowmen on backing vocals and instrumentation by the Henri René Orchestra.[113][139] Another hit version was by Percy Faith and the Shillelagh Singers in 1950.[57] Also recorded on successful Christmas albums by Bing Crosby, Bobby Vinton and Anne Murray."
112,christmas in my hometown,Sonny James,1954,Covered by Travis Tritt in 1992
113,christmas in my home town[140],Charley Pride,1970,Peaked at No. 11 on the Billboard Christmas Singles chart.[38]
114,christmas in new orleans,Louis Armstrong with the Benny Carter Orchestra,1955,
115,christmas in the caribbean,Jimmy Buffett,1985,
116,christmas in the city,Elizabeth Chan,2014,Peaked at No. 29 on the Billboard Adult Contemporary chart in 2015.
117,christmas in your arms,Steve Wariner,2000,Peaked at No. 65 on the Billboard Hot Country Songs chart.[55][141]
118,christmas is ,Percy Faith,1966,"Written by Percy Faith and Spencer Maxwell. Originally recorded by Percy Faith in 1964 as an instrumental (""Judy""). Selected as the theme song for the 1967 Christmas Seals appeal. Also a hit that year for Lou Rawls."
119,christmas is ,Jim Brickman featuring Mark Masri,2008,Peaked at No. 18 on the Billboard Hot Adult Contemporary Tracks chart during the Christmas season of 2008.[142]
120,christmas is for children,Glen Campbell,1968,"Written by Sammy Cahn. Peaked at #7 on Billboard's ""Best Bets For Christmas"" survey, December 1968.[91]"
121,christmas is going to the dogs,Eels,2000,From the 2000 film How the Grinch Stole Christmas.
122,christmas is just a song for us this year,Louise Mandrell and R.C. Bannon,1982,"B-side of ""Christmas in Dixie"" by Alabama. Reached No. 35 on the Hot Country Singles chart in 1982.[143]"
123,christmas is just around the corner,Barry Manilow,2008,Reached No. 16 on the Billboard Hot Adult Contemporary Tracks chart.[144]
124,christmas is now drawing near at hand,Steve Winwood,1997,From the album A Very Special Christmas 3.
125,christmas is the time to say 'i love you',Billy Squier,1981,"Originally released as the B-side of Squier's 1981 single ""My Kinda Lover"".[145]"
126,christmas island,The Andrews Sisters with Guy Lombardo and His Royal Canadians,1946,"Peaked at No. 7 on the Billboard Pop charts in 1946. Re-charted in 1947 and 1949.[2] Also a hit for Jimmy Buffett (1996), and The Brian Setzer Orchestra (2005)."
127,christmas kisses,The Bookends,1961,With the Ray Anthony orchestra.
128,christmas lights,Coldplay,2010,Digital download track that peaked at No. 25 on the Billboard Hot 100 and No. 12 on the Billboard Hot Digital Songs chart.[146]
129,a christmas love,Johnny Kaye with the Morty Jay Orchestra,1963,"Charted for 1 week on the Christmas Singles chart, peaking at No. 20.[10]"
130,christmas lullaby,Cary Grant,1967,Written by Peggy Lee and Cy Coleman.[93]
131,christmas medley,The Salsoul Orchestra,1976,"A 12-minute, 8-second disco medley of holiday songs performed by the backing band for Salsoul Records, containing the songs: ""Joy To The World""/""Deck The Halls""/""O Come All Ye Faithful""/""Jingle Bells""/""Hark! The Herald Angels Sing""/""Santa Claus Is Coming To Town""/""The Christmas Song""/""White Christmas""/""Rudolph The Red-Nosed Reindeer""/""I'll Be Home For Christmas""/""Winter Wonderland""/""The First Noël""/""We Wish You A Merry Christmas"". The B-side of the single was ""New Year's Medley"", a 7-minute, 17-second medley of new year's-related songs."
132,christmas memories,Frank Sinatra,1975,"Also recorded by Alabama (1985), Steve Wariner (1992), Rosemary Clooney (1996), and Barbra Streisand (2001). Sometimes titled ""Christmas Mem'ries""."
133,christmas must be tonight,The Band,1977,"From the album Islands. Written by band member Robbie Robertson, who recorded a solo version in 1988 for the soundtrack to the film Scrooged."
134,christmas night in harlem,Louis Armstrong with the Benny Carter Orchestra.,1955,"Song originated in 1934. A hit, in that year, by the Paul Whiteman orchestra."
135,christmas party,"""Two Ton"" Baker the Merry Music Maker",1948,"Issued as a 2-disc (in a foldout picture sleeve) 78 rpm set on Mercury Records' Miniature Playhouse children's series (songs on the set are ""The Night Before Christmas""/""Santa's Toy Shop""/""Up on the House Top""/""Deck The Halls""/""Jingle Bells"").[143]"
136,christmas rappin',Kurtis Blow,1979,"Charted on the Billboard R&B chart in 1993, 1994, 1996 and 2000.[147][148]"
137,christmas saves the year,Twenty One Pilots,2020,
138,the christmas shoes,NewSong,2000,"Spent one week at No. 1 on the Billboard Adult Contemporary chart, and also peaked at No. 42 on the Billboard Hot 100 chart and No. 31 on the Hot Country Songs chart.[100][149] From the album Sheltering Tree."
139,christmas shopping,Buck Owens and his Buckaroos,1968,From Owens' album of the same name. Reached No. 5 on the Billboard Christmas chart.[150]
140,christmas song,Dave Matthews Band,2000,
141,the christmas song,Angel,1977,"A version of the rock band's own 1977 hit ""The Winter Song"", but featuring alternate lyrics (both tracks featured The California Boys Choir and both were produced by Eddie Leonetti)."
142,the christmas song ,The King Cole Trio,1946,"Written in 1944 by Mel Tormé and Robert Wells. Sometimes subtitled ""Chestnuts Roasting on an Open Fire"", but originally subtitled ""Merry Christmas to You."" Peaked at No. 3 on both the Billboard Records Most-Played On The Air and Juke Box Race Records charts in December 1946.[151][152]"
155,christmas spirit,Richard Marx,2011,"Written by Richard Marx and Fee Waybill, the song peaked at No. 15 on the Adult Contemporary chart."
156,christmas tears,Freddy King,1961,"R&B hit in 1961; also charted on the Christmas Singles chart in 1964 & 1966.[45][161] Released in 1964 by The Four Seasons as the B-side to ""I Saw Mommy Kissing Santa Claus""."
157,christmas this year,Mêlée,2008,
158,christmas through your eyes,Gloria Estefan,1992,"Reached the British pop singles chart in 1992 as a double-A side with ""Miami Hit Mix"". From the album Christmas Through Your Eyes."
159,christmas time ,Bryan Adams,1985,"A different picture sleeve was issued in 1986. Peaked at No. 4 on the Billboard Christmas singles chart, and No. 35 on the Mainstream Rock Tracks chart in 1985.[39][162]"
160,christmas time ,John Anderson,1994,Reached No. 57 on the Billboard Hot Country Singles & Tracks chart in 1995.[2][163][164]
161,christmas time ,Christina Aguilera,2000,Released as a promotional single for the album My Kind of Christmas.
162,christmas time ,The Beatles,1967,Also recorded by group member Ringo Starr for his 1999 Christmas album I Wanna Be Santa Claus.
163,christmas time is here ,Vince Guaraldi Trio,1965,"Originally composed for the 1965 animated TV special A Charlie Brown Christmas. Melody has similar chord progression to the 1932 Cole Porter jazz standard ""Night and Day"". Also a hit for Toni Braxton, Shawn Colvin, and Johnny Mathis. Both instrumental and vocal versions were recorded by Guaraldi."
164,christmas time is here ,"Ray Parker, Jr.",1982,"Re-issued in 1984 as the B-side of Parker's top 40 pop hit single, ""Jamie""."
165,christmas time's a-comin',Sammy Kershaw,1994,Peaked at No. 50 on the Billboard Country chart in 1995. Recharted in 1998.[45][165]
166,christmas tonight,Dave Barnes with Hillary Scott,2010,Reached No. 9 on the Billboard Hot Adult Contemporary Tracks chart.[166]
